<?xml version="1.0" encoding="utf-8"?>

<Game xmlns:xsi="http://www.w3.org/2001/XMLSchema-instance" xsi:noNamespaceSchemaLocation="Schemas/schema_game.xsd">
    <TextureLibrary>TextureLibrary.xml</TextureLibrary>
    <SpriteLibrary>SpriteLibrary.xml</SpriteLibrary>
    <Settings>Settings.xml</Settings>
    <AnimationLibrary>AnimationLibrary.xml</AnimationLibrary>
    <TileLibrary>TileLibrary.xml</TileLibrary>
    <ParticleDefinitions>ParticleDefinitions.xml</ParticleDefinitions>
    <WeaponLibrary>WeaponLibrary.xml</WeaponLibrary>
    <EnemyLibrary>EnemyLibrary.xml</EnemyLibrary>
    <PickupLibrary>PickupLibrary.xml</PickupLibrary>
    <Player>
        <CollisionBox x="2" y="0" width="18" height="48" />
        <Animations>
            <Animation id="0" action="0" />
            <Animation id="1" action="1" />
            <Animation id="2" action="2" />
            <Animation id="3" action="3" />
            <Animation id="4" action="4" />
            <Animation id="5" action="5" />
        </Animations>
    </Player>
    <Worlds>
        <World>world_1.xml</World>
        <World>world_2.xml</World>
    </Worlds>
</Game>